profile_id,name,country,state_province,high_school_type,high_school_name,high_school_location,gpa_unweighted,gpa_weighted,test_type,test_score,coursework_rigor,ap_ib_hl_count,intended_major,secondary_interests,hook_context,overall_strength_bucket,accept_count,reject_count,waitlist_count,activities,awards,decisions_compact,narrative_summary,created_at
SP-3215,Layla Chen,United States,California,Public,Palo Alto High School,"Palo Alto, California",3.65,3.98,SAT,1390,Rigorous,6,Environmental Science,Biology | Public Policy,Asian American | Outdoor education leader,Balanced,12,7,1,Environmental Club President (School) | City Parks Volunteer (City) | Science Olympiad (Regional) | Cross Country (City) | Climate Action Blog (Local) | Summer Field Research (State) | Tutoring Program (School) | Recycling Drive Lead (City) | Photography Club (School) | Habitat Builds (City),State Science Fair Honorable Mention (State) | AP Scholar (National) | City Service Award (City) | Regional Science Day Medal (Regional) | School Leadership Award (School),UC Berkeley [Environmental Science] Rejected | UCLA [Environmental Science] Rejected | University of Washington [Environmental Science] Waitlisted | UC San Diego [Environmental Systems] Accepted | UC Davis [Environmental Science] Accepted | University of Oregon [Environmental Science] Accepted | University of Colorado Boulder [Environmental Studies] Accepted | University of Vermont [Environmental Science] Accepted | University of British Columbia [Natural Resources Conservation] Accepted | University of Toronto [Environmental Science] Rejected | San Diego State University [Environmental Science] Accepted | Arizona State University [Environmental Science] Accepted | Oregon State University [Environmental Science] Accepted | Penn State University [Environmental Science] Accepted | Temple University [Environmental Studies] Accepted | UC Santa Cruz [Environmental Studies] Accepted | University of Massachusetts Amherst [Environmental Science] Accepted | University of New Hampshire [Environmental Science] Accepted | Cal Poly Humboldt [Environmental Science] Accepted | University of Nevada Reno [Environmental Science] Accepted,"Selective West Coast programs were mixed, while many strong environmental programs admitted based on sustained service and field work.",2025-10-06T01:22:20Z
SP-3216,Aiden Rivera,United States,Illinois,Public,Whitney Young Magnet High School,"Chicago, Illinois",3.58,3.9,ACT,28,Moderate,5,Architecture,Urban Planning | Art History,Latino | Part time work,Safety Heavy,14,6,0,Design Build Club (School) | Art Portfolio Studio (Regional) | Community Mural Project (City) | JV Soccer (School) | CAD Club (School) | Habitat for Humanity (City) | Photography Club (School) | Student Council Arts Rep (School) | Weekend Barista (Local) | Museum Docent Volunteer (City),City Arts Award (City) | Regional Portfolio Recognition (Regional) | School Service Award (School) | AP Scholar (National) | State Art Fair Finalist (State),Cornell University [Architecture] Rejected | Rice University [Architecture] Rejected | Carnegie Mellon University [Architecture] Rejected | University of Southern California [Architecture] Rejected | Pratt Institute [Architecture] Waitlisted | University of Illinois at Urbana-Champaign [Architecture] Accepted | University of Cincinnati [Architecture] Accepted | Cal Poly San Luis Obispo [Architecture] Rejected | Virginia Tech [Architecture] Accepted | Syracuse University [Architecture] Accepted | University of Arizona [Architecture] Accepted | University of Oregon [Architecture] Accepted | Temple University [Architecture] Accepted | University of Colorado Denver [Architecture] Accepted | University of Massachusetts Amherst [Architecture] Accepted | Drexel University [Architecture] Accepted | New Jersey Institute of Technology [Architecture] Accepted | University of New Mexico [Architecture] Accepted | Kent State University [Architecture] Accepted | University of Nevada Las Vegas [Architecture] Accepted,"Portfolio growth and practical build work won many solid options, while top architecture reaches did not land.",2025-10-06T01:22:30Z
SP-3217,Noor Al-Sayeed,United Kingdom,,International,Manchester Grammar School,"Manchester, England",3.94,,SAT,1500,Very Rigorous,10,Finance,Economics | Data Analytics,International student | Debate,Strong Balanced,13,6,1,Investment Society President (School) | Debate Captain (National) | Internship at Asset Manager (City) | Charity Treasurer (City) | Football First XI (School) | Economics Olympiad Team (National) | Student Newspaper Markets Column (School) | Peer Tutor (School) | Coding for Markets Projects (Local) | Model UN (National),UK Economics Olympiad Merit (National) | AP Scholar with Distinction (National) | City Youth Finance Award (City) | Debate National Finalist (National) | School Leadership Award (School),"University of Pennsylvania [Wharton] Rejected | London School of Economics [Finance] Rejected | University of Chicago [Economics] Rejected | Columbia University [Financial Economics] Rejected | NYU [Stern Finance] Waitlisted | University of Michigan [Ross Finance] Accepted | University of Toronto [Finance] Accepted | University of Warwick [Accounting and Finance] Accepted | University of Manchester [Finance] Accepted | University of Edinburgh [Economics and Finance] Accepted | Boston University [Finance] Accepted | Northeastern University [Finance] Accepted | University of Wisconsin–Madison [Finance] Accepted | Penn State University [Finance] Accepted | University of Florida [Finance] Accepted | University of Colorado Boulder [Finance] Accepted | Arizona State University [Finance] Accepted | University of Oregon [Finance] Accepted | University of Leeds [Finance] Accepted | City, University of London [Finance] Accepted","Ultra selective finance programs were out of reach, but several excellent business schools admitted.",2025-10-06T01:22:40Z
SP-3218,Zoe Huang,Singapore,,International,Anglo Chinese School Independent,Singapore,3.88,,SAT,1490,Very Rigorous,11,Statistics,Computer Science | Economics,International Baccalaureate | Service lead,Strong Balanced,14,5,1,Math Olympiad Team (National) | Coding Club (Regional) | Community Tutoring (City) | Badminton Team (School) | Data for Good Project (City) | Science Research (Regional) | Debate (State) | Volunteer Coordinator (City) | Piano (School) | Student Council (School),AP Scholar National (National) | Regional Data Challenge Winner (Regional) | City Service Award (City) | IB Academic Honor (International) | School Leadership Award (School),Harvard University [Statistics] Rejected | MIT [Mathematics] Rejected | Columbia University [Statistics] Rejected | University of Chicago [Statistics] Rejected | Duke University [Statistical Science] Waitlisted | University of Toronto [Statistics] Accepted | University of Waterloo [Statistics] Accepted | University of British Columbia [Statistics] Accepted | University of Washington [Statistics] Accepted | UC San Diego [Statistics] Accepted | UC Berkeley [Statistics] Rejected | UCLA [Statistics] Accepted | University of Michigan [Statistics] Accepted | Georgia Tech [Mathematics] Accepted | Boston University [Statistics] Accepted | Northeastern University [Data Science] Accepted | Arizona State University [Statistics] Accepted | Penn State University [Statistics] Accepted | University of Oregon [Statistics] Accepted | University of Colorado Boulder [Statistics] Accepted,"Very top stats programs declined, while Canadian and US targets admitted widely.",2025-10-06T01:22:50Z
SP-3219,Luca Bianchi,United States,New York,Private,Regis High School,"New York, New York",3.93,4.42,SAT,1540,Very Rigorous,12,Political Science,Philosophy | Economics,First generation | Debate captain,Reach Heavy,13,6,1,Debate Captain (National) | Mock Trial (State) | Civic Internship (City) | Model UN Chair (National) | Newspaper Opinion Editor (School) | Community Organizer (City) | Varsity Fencing (School) | Peer Tutor (School) | Research Assistant Political Theory (Local) | Youth Voter Drive Lead (City),TOC Debate Bid (National) | AP Scholar with Distinction (National) | City Civic Service Award (City) | State Mock Trial Medal (State) | School Leadership Award (School),Harvard University [Government] Rejected | Yale University [Political Science] Rejected | Columbia University [Political Science] Rejected | Princeton University [Politics] Rejected | University of Chicago [Political Science] Waitlisted | Georgetown University [Government] Accepted | University of Virginia [Politics] Accepted | New York University [Politics] Accepted | University of Michigan [Political Science] Accepted | Boston University [Political Science] Accepted | Northeastern University [Political Science] Accepted | University of North Carolina Chapel Hill [Political Science] Rejected | UC San Diego [Political Science] Accepted | University of Maryland [Government and Politics] Accepted | University of Rochester [Political Science] Accepted | Temple University [Political Science] Accepted | Penn State University [Political Science] Accepted | University of Delaware [Political Science] Accepted | University of Oregon [Political Science] Accepted | University of Vermont [Political Science] Accepted,"Ivy reaches did not hit, but policy oriented targets like Georgetown and UVA admitted.",2025-10-06T01:23:00Z
SP-3220,Amelia Carter,United States,Massachusetts,Boarding,Phillips Academy Andover,"Andover, Massachusetts",3.9,4.3,ACT,33,Very Rigorous,11,Film and Media,Journalism | Design,Legacy at a non Ivy | Festival awards,Strong Balanced,14,5,1,Film Club President (School) | Festival Short Director (National) | Yearbook Design Lead (School) | Community Media Center Volunteer (City) | Photography Award Portfolio (Regional) | Podcast Producer (Local) | Theater Tech Crew (School) | Intern at Production House (City) | Social Media for Nonprofits (City) | Summer Film Intensive (Regional),National Student Film Award Finalist (National) | Scholastic Art Gold Key (Regional) | School Arts Distinction (School) | City Youth Arts Award (City) | AP Scholar (National),USC [Cinema and Media Studies] Waitlisted | NYU [Tisch Film] Rejected | UCLA [Film and Television] Rejected | Columbia University [Film and Media Studies] Rejected | University of Chicago [Media Arts and Design] Rejected | Boston University [Film and Television] Accepted | Syracuse University [Newhouse Television Radio Film] Accepted | Emerson College [Visual and Media Arts] Accepted | Chapman University [Dodge Film Production] Accepted | Loyola Marymount University [Film Production] Accepted | University of Texas at Austin [Radio Television Film] Accepted | University of Colorado Boulder [Cinema Studies] Accepted | Temple University [Film and Media Arts] Accepted | San Diego State University [Film] Accepted | University of Oregon [Cinema Studies] Accepted | Penn State University [Film Production] Accepted | University of Arizona [Film and Television] Accepted | DePaul University [Cinema] Accepted | University of British Columbia [Film Production] Accepted | University of Toronto [Cinema Studies] Accepted,"Highly selective film BFA programs were tough, while many respected film schools admitted based on festival work.",2025-10-06T01:23:10Z